null,"29 Dec 2011","Address",null,"PR-00002565","VIC",3175,null,"Yan Jin","DANDENONG","17 RYLANDS RD ",8172,145.200356,-37.975809
null,"14 May 2012","Address",null,"PR-00002539","VIC",3146,null,"Camp Australia Pty Limited","GLEN IRIS","1731 MALVERN RD ",8176,145.056918,-37.859504
null,"12 Dec 2011","Address",null,"PR-00006557","VIC",3146,null,"The Camp Australia Foundation Ltd","GLEN IRIS","1731 MALVERN RD ",8177,145.056918,-37.859504
null,"17 Nov 2014","Address","Happy Feet Family Day Care","PR-40001604","VIC",3802,null,"Ilhan Shukri Jama","ENDEAVOUR HILLS","18 BRAMWELL CL ",8179,145.263621,-37.991801
null,"19 Oct 2016","Address","Childcare Friendly Management and Support","PR-40006262","VIC",3029,null,"CFM Support Pty Ltd","TARNEIT","18 LOFTY RD ",8180,144.6673238,-37.8345679
null,"20 Aug 2015","Address","Pan Australia Family Day Care","PR-40004809","VIC",3029,null,"Nyawut Deng Kut","TRUGANINA","19 CIRCUIT DR ",8189,144.7153826,-37.8411347
null,"29 Dec 2011","Address",null,"PR-00002123","VIC",3145,null,"Catherine Child Care Pty Ltd","MALVERN EAST","19 SYDARE AVE ",8190,145.074237,-37.880756
null,"16 Aug 2013","Address","The Next Generation Family Day Care","PR-40000803","VIC",3081,null,"The Next Generation Family Day Care Pty Ltd","HEIDELBERG WEST","193 ORIEL RD ",8192,145.042055,-37.74465
null,"29 Dec 2011","Address",null,"PR-00002082","VIC",3207,null,"Ada Mary A'Beckett Children's Centre Inc","PORT MELBOURNE","2 BATMAN RD ",8194,144.9201581,-37.8381672
null,"27 Apr 2016","Address","FUTURE CHAMPS FAMILY DAY CARE SERVICE","PR-40007534","VIC",3029,null,"JRMH GROUP PTY LTD ATF JRMH Group Trust","TARNEIT","2 STARLING AVE ",8196,144.7017121,-37.8368628
null,"08 May 2015","Address",null,"PR-40002517","VIC",3030,null,"NEXTGEN INTERNATIONAL GROUP PTY LTD","POINT COOK","2 SUNDOWNER PL ",8197,144.7760745,-37.8983244
null,"08 Sep 2014","Address","Afshan Family Day Care","PR-40001390","VIC",3803,null,"Mrs Afshan Sona Qureshi","HALLAM","2 TEGANS CL ",8198,145.276669,-38.000738
null,"06 Jan 2015","Address","NURTURING MINDS FAMILY DAY CARE SERVICES PTY LTD","PR-40001770","VIC",3029,null,"NURTURING MINDS FAMILY DAY CARE SERVICES PTY LTD","TRUGANINA","20 TONY DR ",8204,144.7170428,-37.8444354
null,"23 Jun 2015","Address","Hawli Family Day Care Pty Ltd","PR-40001875","VIC",3029,null,"HAWLI FAMILY DAY CARE PTY LTD","HOPPERS CROSSING","200 MORRIS RD ",8205,144.703719,-37.867052
null,"20 Aug 2015","Address","Northeast Family Day Care Pty Ltd","PR-40002700","VIC",3081,null,"Northeast Family Day Care Pty Ltd","BELLFIELD","21 ASHE CRES ",8208,145.0433609,-37.7532786
null,"02 Mar 2015","Address","Eclipse Early Education Craigieburn","PR-40003313","VIC",3023,null,"PC Lakeside Operations PTY LTD ATF PC Lakeside Operations Unit Trust","CAROLINE SPRINGS","21 CREEKVIEW PL ",8210,144.7361621,-37.7355653
null,"30 May 2016","Address",null,"PR-40007165","VIC",3029,null,"Ioana Lelei","TARNEIT","21 EDMUND DR ",8211,144.6580031,-37.8413387
null,"03 Feb 2014","Address","Colour Our World Family Day Care","PR-40001402","VIC",3197,null,"Suzanne El-Katateny","PATTERSON LAKES","21 PALM ISLAND CT ",8214,145.143758,-38.081141
null,"04 May 2015","Address",null,"PR-40002151","VIC",3174,null,"Lakshmi Sosale Thadvanam","NOBLE PARK","21 REX CT",8215,145.174351,-37.976354
null,"01 Mar 2017","Address","Heroes and Champs","PR-40009690","VIC",3151,null,"Heroes and Champs Pty Ltd ATF TN Tsakalidis Family Trust","BURWOOD EAST","22 ORLOFF CT ",8218,145.133978,-37.855412
null,"29 Dec 2011","Address",null,"PR-00001871","VIC",3053,null,"The University of Melbourne","CARLTON","228 QUEENSBERRY ST ",8221,144.960969,-37.8041048
null,"05 Apr 2016","Address","PLAY N LEARN FAMILY DAY CARE PTY. LTD.","PR-40004569","VIC",3029,null,"PLAY N LEARN FAMILY DAY CARE PTY. LTD.","TRUGANINA","23 GALEFF AVE ",8222,144.7090239,-37.8417597
null,"08 May 2017","Address","Tween FOMO","PR-40009117","VIC",3156,null,"E BOLT & J.R HUNT","FERNTREE GULLY","24 BLUCHER ST ",8228,145.289853,-37.8992
null,"29 Dec 2011","Address",null,"PR-00001759","VIC",3174,null,"Wendy Mcguigan; Roberta Whyte","NOBLE PARK","243 CORRIGAN RD ",8233,145.166299,-37.97695
null,"14 Aug 2014","Address",null,"PR-40002239","VIC",3136,null,"BB GLOBAL VICTORIA PTY LTD","CROYDON","24A HULL RD ",8234,145.2930319,-37.7966703
null,"16 Jul 2016","Address","Goodwill Family Day Care Pty Ltd","PR-40007620","VIC",3030,null,"Goodwill Family Day Care Pty Ltd","WERRIBEE","25 PIGEON ST ",8238,144.667138,-37.887977
null,"20 Apr 2016","Address","TWINKLE TWINKLE FAMILY DAY CARE SERVICES PTY LTD","PR-40005529","VIC",3029,null,"TWINKLE TWINKLE FAMILY DAY CARE SERVICES PTY LTD","TRUGANINA","26 EMERSON DR ",8242,144.7291246,-37.8497452
null,"29 Dec 2011","Address",null,"PR-00001786","VIC",3146,null,"Rowen Street Kindergarten Inc","GLEN IRIS","27 ROWEN ST ",8245,145.088287,-37.8579867
null,"17 Jun 2013","Address","Sherpa Kids Mount Waverley","PR-40000584","VIC",3149,null,"Propers Tree Pty Ltd ATF Lim Family Trust","MOUNT WAVERLEY","27 WADHAM PDE ",8246,145.125159,-37.872846
null,"15 Mar 2016","Address",null,"PR-40006294","VIC",3162,null,"JH KIDS SUNSHINE ENTERPRISES PTY LTD","CAULFIELD SOUTH","28 SEA VIEW ST ",8252,145.0174838,-37.8932953
null,"02 May 2016","Address","Bross Yako","PR-40005105","VIC",3064,null,"Bross Yako","ROXBURGH PARK","28 SPENCE AVE ",8253,144.923843,-37.623037
null,"13 Jun 2014","Address","5 Stars Family Day Care","PR-40001438","VIC",3037,null,"5 Stars Family Day Care Pty Ltd","HILLSIDE","28 WOLVISTON AVE ",8255,144.7490294,-37.6863011
null,"04 Mar 2013","Address","The Royal Family Day Care","PR-40000424","VIC",3047,null,"THE ROYAL FAMILY DAY CARE PTY LTD","DALLAS","2A DARGIE CT",8261,144.930859,-37.673227
null,"24 Dec 2015","Address",null,"PR-40002731","VIC",3030,null,"WERRIBEE EARLY YEARS PTY. LTD.","WERRIBEE","2A LEIGH ST ",8262,144.649594,-37.889061
null,"30 Sep 2016","Address",null,"PR-40006986","VIC",3060,null,"Khalid Mahmood","FAWKNER","3 ALEC CRES ",8264,144.969984,-37.695432
null,"08 Mar 2016","Address","Blessed Nest Services","PR-40004429","VIC",3754,null,"The Partnership of S ANTHONY and P.N VEERAPEN","MERNDA","3 LEITH DR ",8265,145.0679977,-37.6008376
null,"02 Sep 2013","Address","Kids In Family Day Care","PR-40000990","VIC",3146,null,"T & S Pty Ltd","GLEN IRIS","3 ROWEN ST ",8266,145.085965,-37.857715
null,"14 Jan 2016","Address",null,"PR-40006089","VIC",3030,null,"DAALO FAMILY DAY CARE PTY LTD","DERRIMUT","3 WALMER RD ",8268,144.7606393,-37.7844266
null,"26 Feb 2013","Address","Daalo Family Day Care","PR-40000181","VIC",3030,null,"Noora Mohamed","DERRIMUT","3 WALMER RD ",8269,144.7606393,-37.7844266
null,"15 Jun 2016","Address","Jellicoe family day Care","PR-40007700","VIC",3174,null,"Safia Hassan","NOBLE PARK","30 CALLANDER RD ",8270,145.178172,-37.960444
null,"29 Dec 2011","Address",null,"PR-00002530","VIC",3121,null,"Extend (Australia) Pty Ltd","RICHMOND","30-32 HULL ST ",8271,144.9979358,-37.8175307
null,"01 Oct 2013","Address","Aspire Family Day Care","PR-40001093","VIC",3047,null,"ASPIRE FAMILY DAY CARE & TRAINING SERVICES PTY LTD","BROADMEADOWS","304 CAMP RD ",8275,144.932234,-37.686647
null,"17 Jun 2013","Address","Bright Minds Family Day Care","PR-40000670","VIC",3064,null,"Mrs Hakuma Hasan","ROXBURGH PARK","31 CORONET AVE ",8276,144.9146963,-37.6122924
null,"29 Dec 2011","Address",null,"PR-00003042","VIC",3082,null,"St Francis of Assisi Out of School Care Program","MILL PARK","312 CHILDS ROAD ",8281,145.0588807,-37.665654
null,"29 Dec 2011","Address",null,"PR-00002223","VIC",3084,null,"Vindaloo Partnership trading as Rosanna Village Child Care Centre","ROSANNA","32 TURNHAM AVE ",8286,145.066976,-37.743845
null,"28 Feb 2014","Address",null,"PR-40000809","VIC",3173,null,"LITTLE PUMPKINS FAMILY DAY CARE PTY. LTD.","KEYSBOROUGH","33 ELMSWOOD BLVD ",8288,145.1494178,-37.9965282
null,"20 Aug 2015","Address","Violet Early Education Group Pty Limited","PR-40004400","VIC",3123,null,"VIOLET EARLY EDUCATION GROUP PTY LIMITED","HAWTHORN EAST","33 MOUNT IDA AVE ",8293,145.0499967,-37.8380737
null,"20 Nov 2015","Address","PHILLIPS FANNY","PR-00009092","VIC",3141,null,"Fanny Phillips","SOUTH YARRA","33A ARGO ST ",8294,144.987487,-37.843849
null,"29 Dec 2011","Address",null,"PR-00001609","VIC",3194,null,"Kingston City Council","MENTONE","34 BRINDISI ST ",8295,145.0635266,-37.9844229
null,"25 Sep 2013","Address","PlayHouse Family Daycare Scheme","PR-40001014","VIC",3805,null,"Paimana Sadat","NARRE WARREN","34 LONDON CRES ",8296,145.310024,-37.996775
null,"29 Dec 2011","Address",null,"PR-00002440","VIC",3140,null,"Lilydale Children Pty Ltd","LILYDALE","35 CAVE HILL ROAD ",8301,145.3428052,-37.75693
null,"07 Jul 2015","Address","BUILDING BLOCKS EARLY LEARNING GROUP PTY LTD","PR-40002535","VIC",3802,null,"BUILDING BLOCKS EARLY LEARNING GROUP PTY LTD","ENDEAVOUR HILLS","35 CHANTELL AVE ",8302,145.271671,-37.971931
null,"29 Dec 2011","Address",null,"PR-00002112","VIC",3124,null,"William James Cavanagh & Gayle Dawn Cavanagh","CAMBERWELL","35 MOREY ST ",8304,145.096422,-37.841347
null,"29 Dec 2011","Address",null,"PR-00002377","VIC",3165,null,"Developmental Learning Centre Rainbow Pty Ltd","EAST BENTLEIGH","359-361 CHESTERVILLE RD ",8307,145.063349,-37.927746
null,"29 Dec 2011","Address",null,"PR-00002906","VIC",3806,null,"Berwick Primary School O.S.H.C","BERWICK","37 FAIRHOLME BLVD ",8311,145.353868,-38.044
null,"01 Jan 2012","Address",null,"PR-00006543","VIC",3206,null,"SLK Trading Preston Pty Ltd","MIDDLE PARK","375 DANKS ST ",8312,144.961764,-37.852376
null,"30 Sep 2016","Address",null,"PR-40007070","VIC",3029,null,"Amsha Nahid","TRUGANINA","38 TALLIVER TCE ",8317,144.7154236,-37.8472326
null,"10 Aug 2015","Address","Kids Town Family Daycare","PR-40001340","VIC",3049,null,"KIDS TOWN FAMILY DAYCARE PTY. LTD","ATTWOOD","39 HARRICKS CRES ",8320,144.896001,-37.671488
null,"20 Apr 2016","Address",null,"PR-40006484","VIC",3806,null,"Angelic Baby Pty Ltd ATF Angelic Baby Unit Trust","BERWICK","39 HEDGELEY DR ",8321,145.339957,-38.059646
null,"19 Apr 2017","Address",null,"PR-40009963","VIC",3135,null,"ME FOR KIDS PTY LTD","HEATHMONT","4 BARROW DR ",8322,145.243054,-37.837454
null,"24 Jun 2014","Address","Little Learners Day Care Centre","PR-40001464","VIC",3030,null,"Filmac Child Services Pty Ltd ATF Filmac Child Services Trust","WERRIBEE","4 FILIPPIN CT ",8323,144.666439,-37.907616
null,"02 May 2016","Address",null,"PR-40007263","VIC",3056,null,"EARLY START FAMILY DAY CARE AND TRAINING PTY. LTD.","BRUNSWICK","4 SHEFFIELD ST ",8325,144.951249,-37.760426
null,"29 Jun 2015","Address","Healthways","PR-40004180","VIC",3104,null,"Wyndella Pty Ltd","BALWYN NORTH","42 DONCASTER RD ",8328,145.068263,-37.792964
null,"05 Feb 2014","Address","Wombat Family Day Care","PR-40001456","VIC",3029,null,"Wombat Family Day Care Pty Ltd","TARNEIT","422 HOGANS RD ",8330,144.6610584,-37.8599571
null,"27 Aug 2013","Address","MAROONDAH KIDS EARLY LEARNING CENTRE","PR-40000806","VIC",3032,null,"DIAMOND KIDS PTY LTD","ASCOT VALE","45 DALGETY DR ",8338,144.9082315,-37.7775937
null,"29 Dec 2011","Address",null,"PR-00001396","VIC",3105,null,"Bulleen Preschool Inc","BULLEEN","5 DERRECK AVENUE ",8353,145.0906111,-37.7652937
null,"02 Sep 2013","Address","FIFTH AVENUE DAY CARE CENTRE","PR-40000893","VIC",3175,null,"FIFTH AVENUE DAY CARE CENTRE INC","DANDENONG","5 FIFTH AVE ",8354,145.2048819,-37.9822712
null,"11 Mar 2016","Address","KID'S PLANET FAMILY DAY CARE","PR-40005140","VIC",3076,null,"K.S ENTERPRISE PTY LTD","EPPING","50 BROADLEAF DR ",8358,145.0027401,-37.6254935
null,"08 Mar 2016","Address","Kimmy Kids Family Day Care","PR-40004876","VIC",3023,null,"FTA RESOURCES PTY LTD","DEER PARK","50 EDMONDSHAW DR ",8359,144.7641956,-37.7774989
null,"01 Jan 2015","Address",null,"PR-00008837","VIC",3076,null,"Alexandra Bombardieri","EPPING","51 KINLORA AVE ",8361,145.030171,-37.6402
null,"29 Dec 2011","Address",null,"PR-00001737","VIC",3129,null,"Parkside Preschool Centre Inc","BOX HILL NORTH","524 ELGAR RD ",8363,145.1166556,-37.8090799
null,"29 Dec 2011","Address",null,"PR-00001678","VIC",3168,null,"Monash Community Family Co-operative Ltd","NOTTING HILL","56 HOWLEYS RD ",8371,145.1376652,-37.9054812
null,"16 Jul 2016","Address","VICTORIAN INHOUSE CARE AND LEARNING","PR-40005539","VIC",3058,null,"MOHAMMAD TARIQ","COBURG","56 OHEA ST ",8372,144.962207,-37.737123
null,"28 Aug 2015","Address",null,"PR-40004444","VIC",3185,null,"Carmela Sidiropoulos","ELSTERNWICK","56 PARKSIDE ST ",8373,145.010772,-37.88955
null,"01 Jan 2012","Address",null,"PR-00006539","VIC",3064,null,"Koala Family Day Care Home Pty Ltd","ROXBURGH PARK","56 SAHI CRES ",8374,144.9342171,-37.6373435
null,"29 Dec 2011","Address",null,"PR-00002927","VIC",3185,null,"Lamdeni School Inc","ELSTERNWICK","569 GLENHUNTLY ROAD ",8375,145.012425,-37.885595
null,"05 Feb 2014","Address",null,"PR-40001310","VIC",3048,null,"Nadar Family Day Care Pty Ltd","MEADOW HEIGHTS","58 ASHLEIGH CRES ",8377,144.918511,-37.653458
null,"29 Dec 2011","Address",null,"PR-00002280","VIC",3072,null,"Northland Kinder Haven Pty Ltd  ATF The Rosenberg Northland Family Trust","PRESTON","59-65 WOOD ST ",8382,145.0279916,-37.7362061
null,"23 Sep 2015","Address","Greenvue Kindergarten","PR-40004433","VIC",3029,null,"GREENVUE KINDERGARTEN PTY. LTD.","TARNEIT","6 WOOTTEN RD ",8383,144.6599595,-37.859845
null,"23 Sep 2015","Address","Cherry Lane Children's Centre","PR-40005352","VIC",3198,null,"CHERRY LANE CHILDREN'S CENTRE PTY LTD","SEAFORD","6-8 ANDREW ST ",8386,145.1409962,-38.1206463
null,"15 May 2013","Address","Brillians Kidz Family Day Care","PR-40000376","VIC",3011,null,"BRILLIANT KIDZ FAMILY DAY CARE PTY. LTD.","FOOTSCRAY","62 IRVING ST ",8389,144.8994463,-37.8020614
null,"19 Mar 2015","Address","Learning Nest","PR-40002802","VIC",3064,null,"Baseko Pty Ltd ATF Baseko Family Trust","ROXBURGH PARK","63 HAYFIELD RD ",8395,144.920436,-37.612708
null,"16 Jan 2017","Address","CHILDREN'S CORNER LEARNING CENTRE","PR-40009832","VIC",3192,null,"AUSTRALIA TWINKLE STAR PTY LTD ATF TWINKLE STAR UNIT TRUST","CHELTENHAM","63 NANCY ST ",8396,145.080933,-37.971343
null,"03 Nov 2014","Address",null,"PR-40002526","VIC",3192,null,"READY EDUCATION PTY LTD","CHELTENHAM","63 NANCY ST ",8397,145.080933,-37.971343
null,"29 Dec 2011","Address",null,"PR-00002274","VIC",3042,null,"Mondo Corporation Pty Ltd","AIRPORT WEST","63-69 MCNAMARA AVE ",8398,144.881187,-37.7249853
null,"24 Nov 2014","Address","All Round Kinder Care","PR-40002539","VIC",3124,null,"Our ARK Pty Ltd","CAMBERWELL","66 ATHELSTAN RD ",8403,145.063687,-37.843814
null,"12 Feb 2015","Address","Care For Me Family Day Care","PR-40001763","VIC",3029,null,"Akuch Kuol Anyieth","TARNEIT","69 KINGBIRD AVE ",8407,144.6638841,-37.8335623
null,"19 Dec 2016","Address","KOOL KIDZ RAVENHALL PTY.LTD.","PR-40008769","VIC",3029,null,"TRISKELION GROUP PTY. LTD. ATF TRISKELION UNIT TRUST","TARNEIT","7 ARMADALE CT ",8408,144.6652652,-37.8350046
null,"12 May 2016","Address","DONUM DEI PTY. LTD.","PR-40005119","VIC",3109,null,"DONUM DEI PTY LTD","DONCASTER EAST","7 NARTANDA CT ",8411,145.1821146,-37.7648974
null,"29 Dec 2011","Address",null,"PR-00002822","VIC",3130,null,"Old Orchard Primary School","BLACKBURN NORTH","70 - 88 KOONUNG ROAD ",8414,145.1524753,-37.8073289
null,"29 Dec 2011","Address",null,"PR-00002598","VIC",3980,null,"Kidz Kastle P/L","TOORADIN","71 SOUTH GIPPSLAND HWY ",8416,145.3779854,-38.2105717
null,"29 Dec 2011","Address",null,"PR-00002391","VIC",3931,null,"Edenlilly Pty Ltd","MORNINGTON","72 EXFORD DR ",8418,145.068515,-38.220274
null,"29 Dec 2011","Address",null,"PR-00001986","VIC",3150,null,"Caulfield Grammar School","WHEELERS HILL","74-82 JELLS RD ",8419,145.190604,-37.899572
null,"02 Aug 2012","Address",null,"PR-00006486","VIC",3029,null,"Amlakawit Kifle","TRUGANINA","76 EVERHOLME DR ",8421,144.7387841,-37.8404699
null,"09 Apr 2014","Address",null,"PR-40001802","VIC",3090,null,"DEDK Pty Ltd ATF The Trustee for DEDK TRUST","PLENTY","77 MACKELROY RD ",8426,145.116036,-37.673973
null,"29 Dec 2011","Address",null,"PR-00002780","VIC",3174,null,"Silverton Primary School Council","NOBLE PARK NORTH","77-123 JACKSON ROAD ",8427,145.192175,-37.948057
null,"10 Dec 2012","Address","Dalas Family Day Care Pty Ltd","PR-40000307","VIC",3083,null,"Dalas Family Day Care Pty Ltd","BUNDOORA","78 SNAKE GULLY DR ",8430,145.049318,-37.700105
null,"29 Nov 2012","Address","Kids Kare Family Day Care","PR-00008026","VIC",3029,null,"Ubah Dualah","HOPPERS CROSSING","8 COSTA DR ",8431,144.7188432,-37.8744078
null,"24 Dec 2012","Address",null,"PR-40000072","VIC",3028,null,"Meaza Abetew","SEABROOK","8 TRUGANINA AVE ",8432,144.757865,-37.88613
null,"11 Apr 2014","Address",null,"PR-40001593","VIC",3802,null,"LITTLE STARS CHILD CARE & EARLY LEARNING CENTRE PTY LTD","ENDEAVOUR HILLS","82 HEATHERTON RD ",8437,145.2619386,-37.975969
null,"29 Dec 2011","Address",null,"PR-00002805","VIC",3030,null,"Thomas Chirnside Primary School","WERRIBEE","85 WALLS ROAD ",8442,144.6372983,-37.9034399
null,"29 Dec 2011","Address",null,"PR-00002284","VIC",3150,null,"Diako Pty Ltd","WHEELERS HILL","876 WAVERLEY RD ",8446,145.177498,-37.890538
null,"07 Apr 2015","Address","Verity Australia Pty Ltd","PR-40003295","VIC",3152,null,"Verity Australia Pty Ltd","WANTIRNA SOUTH","89 BLOOM AVE ",8448,145.2335271,-37.8789444
null,"24 Nov 2015","Address","Swwet Breeze Family Day Care","PR-40002456","VIC",3023,null,"John Gregory","CAROLINE SPRINGS","9 CLARETOWN AVE ",8451,144.742323,-37.740112
null,"19 Jul 2013","Address",null,"PR-40000669","VIC",3023,null,"Mrs Afaf Ibrahim","BURNSIDE HEIGHTS","93 TENTERFIELD DR ",8458,144.7592838,-37.7330093
null,"29 Dec 2011","Address",null,"PR-00002981","VIC",3074,null,"Thomastown West Primary School","THOMASTOWN","98- 112 MAIN STREET ",8464,145.0020036,-37.6788998
null,"29 Dec 2011","Address",null,"PR-00002679","VIC",3021,null,"St Mary of the Assumption Catholic Church Keilor Downs/Kealba","KEALBA","KEALBA CATH PRIMARY SCHOOL 230-240 SUNSHINE AVE",8471,144.819486,-37.734107
null,"29 Dec 2011","Address",null,"PR-00002546","VIC",3051,null,"Children First Family Day Care Pty Ltd","NORTH MELBOURNE","SUITE 26 204-218 DRYBURGH STREET ",8476,144.9440152,-37.8015423
null,"01 Jan 2012","Address",null,"PR-00006537","VIC",3058,null,"Mirza Group Pty Ltd","COBURG","SUITE 3 LEVEL 1 67 SYDNEY ROAD ",8477,144.964252,-37.753586
null,"19 Jan 2016","Address",null,"PR-40004278","VIC",3029,null,"DALAL FAMILY DAY CARE SERVICES PTY. LTD.","TARNEIT","7 MANDORA GRA ",8478,144.676965,-37.8456255
null,"29 Dec 2011","Address",null,"PR-00001747","VIC",3088,null,"Plenty Valley Montessori School Association","ST HELENA","315 AQUEDUCT ROAD ",8481,145.1370905,-37.6840703
null,"29 Dec 2011","Address",null,"PR-00001702","VIC",3170,null,"Mulgrave Park Preschool Centre Inc","MULGRAVE","68  ALBANY DRIVE ",8482,145.172895,-37.927649
null,"28 May 2013","Address","CHEDER","PR-40000473","VIC",3183,null,"CHEDER INC","ST KILDA EAST","67 HOTHAM ST ",8487,144.999882,-37.865917
null,"29 Dec 2011","Address",null,"PR-00003095","VIC",3152,null,"Stabilozo Pty Ltd","WANTIRNA SOUTH","34 GATESHEAD DVE ",8488,145.241633,-37.865217
null,"26 May 2015","Address","Millennium Kids Family Day Care Pty Ltd","PR-40001772","VIC",3023,null,"Millennium Kids Family Day Care Pty Ltd","DEER PARK","43 FAIRWAYS BVD ",8489,144.7665393,-37.7795147
null,"29 Dec 2011","Address",null,"PR-00002355","VIC",3804,null,"Brandaige Pty Ltd","NARRE WARREN EAST","2 - 4 DORNING ROAD ",8491,145.3773546,-37.9589102
null,"27 Aug 2013","Address","Total Liberty Family Day Care","PR-40000746","VIC",3029,null,"Faapaia Puaka","TARNEIT","161 THAMES BVD ",8493,144.6568864,-37.8687142
null,"29 Dec 2011","Address",null,"PR-00002996","VIC",3183,null,"Beis Efraim College Limited","ST KILDA EAST","24 ROCKBROOK AVE ",8494,145.001168,-37.873833
null,"02 Jan 2015","Address","MyCentre Childcare","PR-40002599","VIC",3059,null,"MyCentre Childcare Pty Ltd","GREENVALE","51 ARNCLIFFE BVD ",8496,144.898436,-37.64026
null,"29 Dec 2011","Address",null,"PR-00002243","VIC",3028,null,"Seabrook Kindergarten Association Inc.","SEABROOK","89 SEABROOK BVD ",8499,144.762483,-37.879953
null,"09 Apr 2014","Address","MODERN FAMILY DAYCARE","PR-40001230","VIC",3072,null,"MODERN FAMILY DAYCARE PTY. LTD.","PRESTON","4 SPARK GR ",8500,145.014733,-37.750807
null,"29 Dec 2011","Address",null,"PR-00002217","VIC",3124,null,"Cangem Pty Ltd","CAMBERWELL","2A ST. ANDRIES STREET ",8505,145.070237,-37.843625
null,"29 Dec 2011","Address",null,"PR-00002152","VIC",3147,null,"Ashwood Children's Centre Inc.","ASHWOOD","6 - 8 YOORALLA STREET ",8508,145.104555,-37.867858
null,"07 Jan 2013","Address","Maranatha Christian School","PR-40000089","VIC",3802,null,"ASSOCIATION FOR CHRISTIAN EDUCATION OF DANDENONG","ENDEAVOUR HILLS","104-108 REEMA BVD ",8523,145.2797664,-37.9709326
null,"23 Dec 2016","Address",null,"PR-40009648","VIC",3182,null,"Stephane Brisson","ST KILDA","2 FOSTER ST ",8524,144.982609,-37.868199
null,"22 Nov 2012","Address","Eildon Road Children's Centre","PR-40000199","VIC",3182,null,"EILDON ROAD CHILDRENS CENTRE INC","ST KILDA","17 EILDON RD ",8526,144.976368,-37.862784
null,"29 Dec 2011","Address",null,"PR-00001478","VIC",3108,null,"Doncaster Park Kindergarten Inc","DONCASTER","18 STUDLEY STREET ",8565,145.1134796,-37.7823309
null,"10 Jan 2013","Address","Yabio's Family Day Care Scheme","PR-40000073","VIC",3021,null,"The GGS Dreams Pty Ltd","ST ALBANS","15 KATE ST ",8534,144.794155,-37.740773
null,"04 Apr 2016","Address",null,"PR-40004049","VIC",3021,null,"GT ADVANCED TRAINING CENTRE PTY. LTD.","ST ALBANS","128 DENTON AVE ",8535,144.801912,-37.763159
null,"02 Mar 2016","Address",null,"PR-40004811","VIC",3030,null,"Noor Al Hoda Abbas","POINT COOK","34 MILES FRANKLIN BVD ",8538,144.7294949,-37.8868486
null,"20 Jan 2014","Address","Kids Planet Family Day Care Services","PR-40001206","VIC",3177,null,"KIDS PLANET FAMILY DAY CARE SERVICES PTY LTD","DOVETON","66 BOTANICAL GR ",8540,145.238423,-37.978733
null,"04 Jun 2012","Address","Growing Minds Family Day Care Service Pty Ltd","PR-00006736","VIC",3975,null,"Growing Minds Family Day Care Services Pty Ltd","LYNDHURST","89 MARRIOTT BVD ",8543,145.2454929,-38.0739565
null,"29 Dec 2011","Address",null,"PR-00002236","VIC",3174,null,"Kinderworld Park Pty Ltd","NOBLE PARK","27 DUNBLANE ROAD ",8552,145.1809737,-37.9610533
null,"29 Dec 2011","Address",null,"PR-00002591","VIC",3195,null,"Sooyeon Lim","ASPENDALE GARDENS","16 PORTLAND PLACE ",8556,145.1270386,-38.0133177
null,"21 Nov 2016","Address","Shirley Robertson Children's Centre","PR-40009019","VIC",3058,null,"SHIRLEY ROBERTSON CHILDRENS CENTRE INC","COBURG","1A CAMERON STREET ",8559,144.9624938,-37.7527365
null,"29 Dec 2011","Address",null,"PR-00001430","VIC",3070,null,"Clifton Street Childrens Centre Inc","NORTHCOTE","55 CLIFTON STREET ",8560,145.0143656,-37.7685185
null,"29 Dec 2011","Address",null,"PR-00002224","VIC",3074,null,"Little Devils Childcare Pty Ltd","THOMASTOWN","6 DOROTHY AVENUE ",8561,145.015682,-37.681268
null,"19 Oct 2012","Address","FAMILY DAY CARE PLUS PTY. LTD.","PR-00006827","VIC",3174,null,"FAMILY DAY CARE PLUS PTY. LTD.","NOBLE PARK","70 NOBLE STREET ",8564,145.168047,-37.968129
null,"29 Dec 2011","Address",null,"PR-00001538","VIC",3150,null,"Glen Waverley South Preschool Inc","GLEN WAVERLEY","43 FRASER STREET ",8568,145.1575063,-37.8944568
null,"29 Dec 2011","Address",null,"PR-00002343","VIC",3149,null,"Harrapan Developments Pty Ltd","MOUNT WAVERLEY","18 HANSEN STREET ",8571,145.116223,-37.881796
null,"29 Dec 2011","Address",null,"PR-00001411","VIC",3201,null,"William Road Preschool Inc","CARRUM DOWNS","20 WILLIAM ROAD ",8572,145.177544,-38.0970176
null,"29 Dec 2011","Address",null,"PR-00001681","VIC",3040,null,"Montgomery Park Children's Centre Inc","ESSENDON","47 LAWSON STREET ",8576,144.9324469,-37.7559024
null,"29 Dec 2011","Address",null,"PR-00002437","VIC",3128,null,"Snuggles Early Learning Centre Pty Ltd ATF Snuggles Early Learning Centre Unit Trust","BOX HILL SOUTH","18 KITCHENER STREET ",8582,145.127939,-37.831732
null,"29 Dec 2011","Address",null,"PR-00003005","VIC",3073,null,"Holy Name Catholic Church Preston East","RESERVOIR","2 ROBB STREET ",8583,145.0182034,-37.7301829
null,"29 Dec 2011","Address",null,"PR-00002332","VIC",3915,null,"Fun 4 Kids Early Learning Centre Pty Ltd","HASTINGS","239 HIGH STREET ",8587,145.1737521,-38.3079166
null,"29 Dec 2011","Address",null,"PR-00002897","VIC",3159,null,"Menzies Creek Primary School Council","MENZIES CREEK","12 SCHOOL ROAD ",8591,145.3942688,-37.9174204
null,"11 Dec 2012","Address","Wyndham Family Day Care Ltd","PR-00007803","VIC",3030,null,"Wyndham Family Day Care Ltd","POINT COOK","12 HIBISCUS CRESCENT ",8599,144.7497145,-37.9037078
null,"29 Dec 2011","Address",null,"PR-00002505","VIC",3058,null,"Yuvam Australia Pty Ltd ATF Yuvam Australia Pty Ltd Unit Trust","COBURG","48 PHILLIPS STREET ",8603,144.954641,-37.746904
null,"29 Dec 2011","Address",null,"PR-00002561","VIC",3070,null,"Nickis Clever Cookies Pty Ltd","NORTHCOTE","57 CUNNINGHAM STREET ",8604,144.999492,-37.782326
null,"29 Dec 2011","Address",null,"PR-00002061","VIC",3138,null,"Gray Court Preschool Inc","MOOROOLBARK","6 GRAY COURT ",8605,145.3279887,-37.7884663
null,"29 Dec 2011","Address",null,"PR-00001943","VIC",3103,null,"Yongala Preschool Inc","BALWYN","25 NOTT STREET ",8609,145.0773101,-37.8060464
null,"29 Dec 2011","Address",null,"PR-00002747","VIC",3109,null,"T & L Childcare Pty Ltd","DONCASTER EAST","6 IRIS COURT ",8612,145.173251,-37.770495
null,"29 Dec 2011","Address",null,"PR-00002527","VIC",3068,null,"Walker Street Community Kindergarten","CLIFTON HILL","89 WALKER STREET ",8614,145.0042166,-37.7887707
null,"29 Dec 2011","Address",null,"PR-00001302","VIC",3130,null,"The Advisory Council for Children with Impaired Hearing (Victoria)","BLACKBURN","137 BLACKBURN ROAD ",8616,145.154952,-37.830645
